{"$id":"https://schemas.micrantha.com/dubnium/v1/capability-request.schema.json","$schema":"https://json-schema.org/draft/2020-12/schema","additionalProperties":false,"allOf":[{"if":{"properties":{"capability":{"properties":{"name":{"const":"example.noop"},"schema_version":{"const":1}},"required":["name","schema_version"]}},"required":["capability"]},"then":{"properties":{"payload":{"$ref":"example-noop-payload.schema.json"},"requested_constraints":{"additionalProperties":false,"properties":{"max_result_bytes":{"maximum":4096,"minimum":64,"type":"integer"}},"required":["max_result_bytes"],"type":"object"}},"required":["requested_constraints"]}}],"description":"Caller-controlled typed invocation request. Actor identity is transport-derived and absent.","properties":{"$schema":{"maxLength":512,"type":"string"},"capability":{"additionalProperties":false,"properties":{"name":{"maxLength":128,"pattern":"^[a-z][a-z0-9]*(?:\\.[a-z][a-z0-9-]*)+$","type":"string"},"schema_version":{"const":1}},"required":["name","schema_version"],"type":"object"},"contract_version":{"const":"1.0"},"evidence_refs":{"items":{"$ref":"common.schema.json#/$defs/reference"},"maxItems":16,"type":"array","uniqueItems":true},"expires_at":{"$ref":"common.schema.json#/$defs/timestamp"},"payload":{"$ref":"common.schema.json#/$defs/jsonObject"},"request_id":{"$ref":"common.schema.json#/$defs/requestId"},"requested_at":{"$ref":"common.schema.json#/$defs/timestamp"},"requested_constraints":{"$ref":"common.schema.json#/$defs/jsonObject","maxProperties":32},"target_ref":{"$ref":"common.schema.json#/$defs/reference"}},"required":["contract_version","request_id","capability","target_ref","payload","requested_at"],"title":"CapabilityRequest v1","type":"object"}
