{
  "contract_version": "1.0",
  "request_id": "request-deployment-synthetic-001",
  "capability": {
    "name": "deployment.apply",
    "schema_version": 1
  },
  "target_ref": "host:synthetic-example",
  "payload": {
    "artifact_ref": "artifact:synthetic-example",
    "mode": "validation-only",
    "source_revision": "0000000000000000000000000000000000000000"
  },
  "requested_constraints": {},
  "evidence_refs": [
    "evidence:synthetic-ci:deployment-001"
  ],
  "requested_at": "2026-08-05T20:00:00Z",
  "expires_at": "2099-01-01T00:00:00Z"
}
