{"capability":{"name":"example.noop","schema_version":1},"contract_version":"1.0","evidence_refs":["evidence:synthetic-ci:001"],"expires_at":"2099-01-01T00:00:00Z","payload":{"message":"hello","repeat":2},"request_id":"request-example-001","requested_at":"2026-08-05T20:00:00Z","requested_constraints":{"max_result_bytes":256},"target_ref":"example:local"}